{
  "id": "urn:ngsi-ld:LinesideDistanceIndication:ldi1",
  "type": "LinesideDistanceIndication",
  "dateCreated": "2026-01-10T09:00:00Z",
  "dateModified": "2026-06-01T12:00:00Z",
  "source": "https://rinf.data.era.europa.eu/",
  "dataProvider": "European Union Agency for Railways (ERA)",
  "linesideDistanceIndicationAppearance": "http://data.europa.eu/949/concepts/lineside-distance-indication-appearance/00",
  "linesideDistanceIndicationFrequency": 250,
  "linesideDistanceIndicationPositioning": "http://data.europa.eu/949/concepts/lineside-distance-indication-positioning/00"
}
